{
  "$schema": "../../../schemas/environment.schema.json",
  "environment_profile_id": "model-direct-v1",
  "name": "model-direct-v1",
  "lifecycle": "active",
  "recipe": {
    "network_policy": "allow",
    "kind": "live-model",
    "model_driver": "live",
    "adapter": {
      "framework": "promptfoo",
      "config": "adapters/promptfoo.yaml",
      "repeats": 3
    }
  }
}
